{
  "dag_id": "research-implement-verify",
  "phase": "completed",
  "node_id": "implement",
  "input": {
    "task": "Implement the solution based on the research findings. Research summary: <research_summary_result>. Recommended approach: <recommended_approach_result>. Task: {{input.task}}",
    "context": {},
    "artifacts": [],
    "parent": {
      "research": {
        "output": {
          "summary": "Completed: Research the following problem and provide a concise summary of findings, existi",
          "data": {
            "research_summary": "<research_summary_result>",
            "recommended_approach": "<recommended_approach_result>",
            "references": "<references_result>"
          },
          "artifacts": [],
          "files_changed": [],
          "decisions": []
        }
      }
    }
  },
  "output": {
    "summary": "Completed: Implement the solution based on the research findings. Research summary: <resear",
    "data": {
      "implementation_files": "<implementation_files_result>",
      "changes_summary": "<changes_summary_result>",
      "new_dependencies": "<new_dependencies_result>"
    },
    "artifacts": [],
    "files_changed": [],
    "decisions": []
  },
  "metadata": {
    "started_at": "2026-07-16T03:09:07.820677+00:00",
    "updated_at": "2026-07-16T03:09:08.991170+00:00",
    "completed_at": "2026-07-16T03:09:08.991141+00:00",
    "errors": [],
    "warnings": [],
    "duration_ms": 1138.2288932800293,
    "retry_count": 0,
    "temperature": 0.4,
    "node_version": "1.0.0"
  }
}