{
  "dag_id": "research-implement-verify",
  "phase": "completed",
  "node_id": "research",
  "input": {
    "task": "Research the following problem and provide a concise summary of findings, existing solutions, and a recommended approach. Problem: {{input.task}}",
    "context": {},
    "artifacts": []
  },
  "output": {
    "summary": "Completed: Research the following problem and provide a concise summary of findings, existi",
    "data": {
      "research_summary": "<research_summary_result>",
      "recommended_approach": "<recommended_approach_result>",
      "references": "<references_result>"
    },
    "artifacts": [],
    "files_changed": [],
    "decisions": []
  },
  "metadata": {
    "started_at": "2026-07-16T03:09:07.073060+00:00",
    "updated_at": "2026-07-16T03:09:07.759375+00:00",
    "completed_at": "2026-07-16T03:09:07.759335+00:00",
    "errors": [],
    "warnings": [],
    "duration_ms": 652.30393409729,
    "retry_count": 0,
    "temperature": 0.6,
    "node_version": "1.0.0"
  }
}