{
  "dag_id": "multi-phase-refactor",
  "phase": "completed",
  "node_id": "implementation",
  "input": {
    "task": "Execute the refactoring plan. Plan: <refactoring_plan_result>. Risk matrix: <risk_matrix_result>. Testing strategy: <testing_strategy_result>. Implement changes phase by phase, maintain backward compatibility, and update tests as needed.",
    "context": {},
    "artifacts": [],
    "parent": {
      "synthesis": {
        "output": {
          "summary": "Completed: Synthesize findings into a unified refactoring plan. Code analysis: <module_map_",
          "data": {
            "refactoring_plan": "<refactoring_plan_result>",
            "phase_order": "<phase_order_result>",
            "risk_matrix": "<risk_matrix_result>",
            "testing_strategy": "<testing_strategy_result>"
          },
          "artifacts": [],
          "files_changed": [],
          "decisions": []
        }
      }
    }
  },
  "output": {
    "summary": "Completed: Execute the refactoring plan. Plan: <refactoring_plan_result>. Risk matrix: <ris",
    "data": {
      "changed_files": "<changed_files_result>",
      "refactoring_log": "<refactoring_log_result>",
      "backward_compat_notes": "<backward_compat_notes_result>",
      "test_updates": "<test_updates_result>"
    },
    "artifacts": [],
    "files_changed": [],
    "decisions": []
  },
  "metadata": {
    "started_at": "2026-07-16T03:08:56.814666+00:00",
    "updated_at": "2026-07-16T03:08:58.014440+00:00",
    "completed_at": "2026-07-16T03:08:58.014418+00:00",
    "errors": [],
    "warnings": [],
    "duration_ms": 1182.8689575195312,
    "retry_count": 0,
    "temperature": 0.3,
    "node_version": "1.0.0"
  }
}