{
  "dag_id": "_verify_realexec",
  "phase": "completed",
  "node_id": "b",
  "input": {
    "task": "echo world",
    "context": {},
    "artifacts": [],
    "parent": {
      "a": {
        "output": {
          "summary": "hello",
          "stdout": "hello\n",
          "stderr": "",
          "returncode": 0,
          "data": {},
          "artifacts": [],
          "files_changed": [],
          "decisions": []
        }
      }
    }
  },
  "output": {
    "summary": "world",
    "stdout": "world\n",
    "stderr": "",
    "returncode": 0,
    "data": {},
    "artifacts": [],
    "files_changed": [],
    "decisions": []
  },
  "metadata": {
    "started_at": "2026-07-19T10:24:35.931042+00:00",
    "updated_at": "2026-07-19T10:24:36.019298+00:00",
    "completed_at": "2026-07-19T10:24:36.019298+00:00",
    "errors": [],
    "warnings": [],
    "duration_ms": 65.02342224121094,
    "retry_count": 0,
    "temperature": 0.7,
    "node_version": "1.0.0"
  }
}